id,titulo,ano_lancamento,generos,generos_unificados,rating,num_avaliacoes,imagem,descricao,metadados
55318,Medalist,2025,"['Drama', 'Sports']",['Drama & Narrativo'],8.37,31065,https://cdn.myanimelist.net/images/anime/1029/146850.jpg,"Tsukasa Akeuraji always dreamed of becoming a competitive solo figure skater, but starting too late in life meant his ambitions never got off the ground. Now barely scraping by, he takes on an assistant coach job, resigned to a future far from the one he once imagined.  Before his first day, Tsukasa meets Inori Yuitsuka, a shy fifth grader sneaking into the rink to practice. Captivated by figure skating, but held back by her mother's overprotectiveness and her own self-doubt, Inori has never been encouraged to pursue her passion until she encounters Tsukasa. Beneath her personality lies great potential, waiting to be unlocked with the right guidance.  Moved by Inori's determination to change and reminded of his own struggles, Tsukasa offers to coach and help her chase the dream she has been too afraid to voice. While the road ahead is long and filled with unfamiliar challenges and rival skaters, Inori dedicates herself to the art and strives to one day reach the Olympics and become a medalist.   [Written by MAL Rewrite]","{'id_original': 55318, 'episodios': 13}"
31646,March Comes In Like a Lion,2016,['Drama'],['Drama & Narrativo'],8.37,296681,https://cdn.myanimelist.net/images/anime/3/82899.jpg,"Having reached professional status in middle school, Rei Kiriyama is one of the few elite in the world of shogi. Due to this, he faces an enormous amount of pressure, both from the shogi community and his adoptive family. Seeking independence from his tense home life, he moves into an apartment in Tokyo. As a 17-year-old living on his own, Rei tends to take poor care of himself, and his reclusive personality ostracizes him from his peers in school and at the shogi hall.  However, not long after his arrival in Tokyo, Rei meets Akari, Hinata, and Momo Kawamoto, a trio of sisters living with their grandfather who owns a traditional wagashi shop. Akari, the oldest of the three girls, is determined to combat Rei's loneliness and poorly sustained lifestyle with motherly hospitality. The Kawamoto sisters, coping with past tragedies, also share with Rei a unique familial bond that he has lacked for most of his life. As he struggles to maintain himself physically and mentally through his shogi career, Rei must learn how to interact with others and understand his own complex emotions.  [Written by MAL Rewrite]","{'id_original': 31646, 'episodios': 22}"
55102,Girls Band Cry,2024,['Drama'],['Drama & Narrativo'],8.36,49758,https://cdn.myanimelist.net/images/anime/1711/140515.jpg,"Everyone yearns to find their true purpose in life. This is also true for Nina Iseri, a 17-year-old girl looking to enroll in a good university, but the world always seems to work against her. On her very first day in Tokyo, she gets lost, ignored, and locked out of her new apartment. However, an unexpected opportunity arises when Nina meets Momoka Kawaragi, one of her favorite guitarists.  After Nina joins Momoka for a street performance, Momoka decides they should start a band together. While Nina initially hesitates, her determination grows as they start acquiring more bandmates—the beautiful drummer Subaru Awa, the aloof keyboardist Tomo Ebizuka, and the intelligent bassist Rupa. The five girls face challenges both in the music industry and within themselves, but their shared passion for music never lets them give up on their dreams.  [Written by MAL Rewrite]","{'id_original': 55102, 'episodios': 13}"
5941,Cross Game,2009,"['Drama', 'Romance', 'Sports']","['Romance', 'Drama & Narrativo']",8.36,53245,https://cdn.myanimelist.net/images/anime/6/22103.jpg,"Kou Kitamura and Aoba Tsukishima are often at odds—even though their families happen to be close friends and business partners. Although the only child of a sports shop owner, Kou has never been interested in playing baseball. Despite this, he possesses an impressive batting ability honed by frequent visits to the local baseball batting center run by the Tsukishima family. On the other hand, Aoba loves to play baseball and is a star player with exceptional pitching form.  However, these two seemingly complete opposites share something very important to them—Wakaba Tsukishima, Aoba's older sister and Kou's destined sweetheart. Admired by the quarrelsome duo, Wakaba often finds herself the catalyst to their never-ending rivalry. But whether or not they realize that they have more in common than either would care to admit, only time will tell. The game of baseball may just be what the pair needs to ultimately overcome their own personal struggles.  [Written by MAL Rewrite]","{'id_original': 5941, 'episodios': 50}"
185,Initial D First Stage,1998,"['Action', 'Drama']","['Ação & Aventura', 'Drama & Narrativo']",8.36,212926,https://cdn.myanimelist.net/images/anime/1384/127972.jpg,"Unlike his friends, Takumi Fujiwara is not particularly interested in cars, with little to no knowledge about the world of car enthusiasts and street racers. The son of a tofu shop owner, he is tasked to deliver tofu every morning without fail, driving along the mountain of Akina. Thus, conversations regarding cars or driving in general would only remind Takumi of the tiring daily routine forced upon him.  One night, the Akagi Red Suns, an infamous team of street racers, visit the town of Akina to challenge the local mountain pass. Led by their two aces, Ryousuke and Keisuke Takahashi, the Red Suns plan to conquer every racing course in Kanto, establishing themselves as the fastest crew in the region. However, much to their disbelief, one of their aces is overtaken by an old Toyota AE86 during a drive back home from Akina. After the incident, the Takahashi brothers are cautious of a mysterious driver geared with remarkable technique and experience in the local roads—the AE86 of Mount Akina.  [Written by MAL Rewrite]","{'id_original': 185, 'episodios': 26}"
30,Neon Genesis Evangelion,1995,"['Avant Garde', 'Award Winning', 'Drama', 'Sci-Fi', 'Suspense']","['Sci-Fi & Fantasia', 'Drama & Narrativo']",8.36,1183375,https://cdn.myanimelist.net/images/anime/1314/108941.jpg,"Fifteen years after a cataclysmic event known as the Second Impact, the world faces a new threat: monstrous celestial beings called Angels invade Tokyo-3 one by one. Mankind is unable to defend themselves against the Angels despite utilizing their most advanced munitions and military tactics. The only hope for human salvation rests in the hands of NERV, a mysterious organization led by the cold Gendou Ikari. NERV operates giant humanoid robots dubbed ""Evangelions"" to combat the Angels with state-of-the-art advanced weaponry and protective barriers known as Absolute Terror Fields.  Years after being abandoned by his father, Shinji Ikari, Gendou's 14-year-old son, returns to Tokyo-3. Shinji undergoes a perpetual internal battle against the deeply buried trauma caused by the loss of his mother and the emotional neglect he suffered at the hands of his father. Terrified to open himself up to another, Shinji's life is forever changed upon meeting 29-year-old Misato Katsuragi, a high-ranking NERV officer who shows him a free-spirited maternal kindness he has never experienced.  A devastating Angel attack forces Shinji into action as Gendou reveals his true motive for inviting his son back to Tokyo-3: Shinji is the only child capable of efficiently piloting Evangelion Unit-01, a new robot that synchronizes with his biometrics. Despite the brutal psychological trauma brought about by piloting an Evangelion, Shinji defends Tokyo-3 against the angelic threat, oblivious to his father's dark machinations.  [Written by MAL Rewrite]","{'id_original': 30, 'episodios': 26}"
41025,To Your Eternity,2021,"['Adventure', 'Drama', 'Supernatural']","['Terror & Suspense', 'Ação & Aventura', 'Sci-Fi & Fantasia', 'Drama & Narrativo']",8.35,411606,https://cdn.myanimelist.net/images/anime/1880/118484.jpg,"An Orb, known only as It, is cast to Earth to be observed from afar. Capable of changing forms from beings whose reflections It captures, It first becomes a rock and then, due to the rising temperature, moss.  It does not move until one snowy day, a wolf at death's door barely crosses by. When It takes the animal's form, It attains awareness of its consciousness and starts to wander with an unclear destination in mind. Soon, It comes across the wolf's master—a young boy waiting for his tribe to return from a paradise abundant with fish and fruit in the south. Although the boy is lonely, he still hopes those whom he holds dear in his memories have not forgotten him and that he will reunite with them one day.  The boy wants to explore new surroundings and decides to abandon his home with It to find the paradise using the traces his tribe left behind. However, with a heavily injured body and no sight of his elder comrades, what will become of the boy?  Fumetsu no Anata e illustrates the story of an immortal being experiencing humanity, meeting all types of people in many places throughout time.  [Written by MAL Rewrite]","{'id_original': 41025, 'episodios': 20}"
2251,Baccano!,2007,"['Action', 'Mystery', 'Supernatural']","['Terror & Suspense', 'Ação & Aventura', 'Estratégia & Puzzle', 'Sci-Fi & Fantasia']",8.35,395639,https://cdn.myanimelist.net/images/anime/3/14547.jpg,"During the early 1930s in Chicago, the transcontinental train, Flying Pussyfoot, is starting its legendary journey that will leave a trail of blood all over the country. At the same time in New York, the ambitious scientist Szilard and his unwilling aide Ennis are looking for missing bottles of the immortality elixir. In addition, a war between the mafia groups is getting worse. On board the Advena Avis, in 1711, alchemists are about to learn the price of immortality.  Based on the award-winning light novels of the same name, Baccano! follows several events that initially seem unrelated, both in time and place, but are part of a much bigger story—one of alchemy, survival, and immortality. Merging these events together are the kindhearted would-be thieves, Isaac and Miria, connecting various people, all of them with their own hidden ambitions and agendas, and creating lifelong bonds and consequences for everyone involved.  [Written by MAL Rewrite]","{'id_original': 2251, 'episodios': 13}"
338,The Rose of Versailles,1979,"['Drama', 'Romance']","['Romance', 'Drama & Narrativo']",8.35,33394,https://cdn.myanimelist.net/images/anime/9/57043.jpg,"In a time of class stratification and rising tensions amongst the impoverished population, the Austrian Empire sends Princess Marie Antoinette to France to be wed to Crown Prince Louis XVI. The political marriage is arranged to strengthen the alliance between both countries, but the future queen is deeply unsatisfied with her fate being decided for her. Upon arrival in the country, Marie Antoinette is acquainted with Oscar Fançois de Jarjayes—Commander of the Royal Guard.  Due to her father's desire for a son, Oscar is raised as a boy with an expectation to inherit his title as The Commander. Though she is revered by both men and women alike, Oscar cannot help but desire to live life as a woman instead of masquerading as a man. As Oscar reluctantly serves the young, spoiled queen, the growing resentment and suffering of the poor become harder for her to ignore—especially when Marie Antoinette frivolously spends her wealth.  [Written by MAL Rewrite]","{'id_original': 338, 'episodios': 40}"
2402,Tomorrow's Joe,1970,"['Drama', 'Sports']",['Drama & Narrativo'],8.34,28209,https://cdn.myanimelist.net/images/anime/5/64671.jpg,"Joe Yabuki is a troubled youth, whose only solution to problems is throwing punches at them. What he lacks in manners and discipline, he makes up for with his self-taught fighting skills.  One day, while wandering the slums of Doya, Joe gets into a fight with the local gang. Although greatly outnumbered, he effortlessly defeats them, drawing the attention of Danpei Tange—a former boxing coach turned alcoholic. Seeing his potential, he offers to train Joe into Japan's greatest boxer. At first, Joe dismisses Danpei as a hopeless drunk; but after the trainer saves his life, he agrees to live with him and learn the art of boxing. Unfortunately, Joe's personality makes him an unruly student, and he often falls back to his old ways.  To survive the harsh world of his new career, Joe needs to trust his mentor and master the techniques taught to him. However, the road to becoming a professional boxer is rife with struggles that will test his mettle to the end.  [Written by MAL Rewrite]","{'id_original': 2402, 'episodios': 79}"
41457,86 Eighty-Six,2021,"['Drama', 'Sci-Fi']","['Sci-Fi & Fantasia', 'Drama & Narrativo']",8.34,486071,https://cdn.myanimelist.net/images/anime/1987/117507.jpg,"According to the Republic of San Magnolia, their ongoing war against the Giadian Empire has no casualties—however, that is mere propaganda. While the silver-haired Alba of the Republic's eighty-five sectors live safely behind protective walls, those of different appearances are interned in a secret eighty-sixth faction. Known within the military as the Eighty-Six, they are forced to fight against the Empire's autonomous Legion under the command of the Republican ""Handlers.""  Vladilena Milizé is assigned to the Spearhead squadron to replace their previous Handler. Shunned by her peers for being a fellow Eighty-Six supporter, she continues to fight against their inhumane discrimination. Shinei Nouzen is the captain of the Spearhead squadron. Infamous for being the sole survivor of every squadron he's been in, he insists on shouldering the names and wishes of his fallen comrades. When the fates of these young souls from two different worlds collide, will it ignite the spark that lights their path to salvation, or will they burn themselves in the flames of despair?  [Written by MAL Rewrite]","{'id_original': 41457, 'episodios': 11}"
39535,Mushoku Tensei: Jobless Reincarnation,2021,"['Adventure', 'Drama', 'Fantasy', 'Ecchi']","['Ação & Aventura', 'Sci-Fi & Fantasia', 'Drama & Narrativo']",8.34,939444,https://cdn.myanimelist.net/images/anime/1530/117776.jpg,"Despite being bullied, scorned, and oppressed all of his life, a 34-year-old shut-in still found the resolve to attempt something heroic—only for it to end in a tragic accident. But in a twist of fate, he awakens in another world as Rudeus Greyrat, starting life again as a baby born to two loving parents.  Preserving his memories and knowledge from his previous life, Rudeus quickly adapts to his new environment. With the mind of a grown adult, he starts to display magical talent that exceeds all expectations, honing his skill with the help of a mage named Roxy Migurdia. Rudeus learns swordplay from his father, Paul, and meets Sylphiette, a girl his age who quickly becomes his closest friend.  As Rudeus' second chance at life begins, he tries to make the most of his new opportunity while conquering his traumatic past. And perhaps, one day, he may find the one thing he could not find in his old world—love.  [Written by MAL Rewrite]","{'id_original': 39535, 'episodios': 11}"
13601,Psycho-Pass,2012,"['Action', 'Mystery', 'Sci-Fi', 'Suspense']","['Terror & Suspense', 'Ação & Aventura', 'Estratégia & Puzzle', 'Sci-Fi & Fantasia']",8.33,821784,https://cdn.myanimelist.net/images/anime/1314/142015.jpg,"Justice, and the enforcement of it, has changed. In the 22nd century, Japan enforces the Sibyl System, an objective means of determining the threat level of each citizen by examining their mental state for signs of criminal intent, known as their Psycho-Pass. Inspectors uphold the law by subjugating, often with lethal force, anyone harboring the slightest ill-will; alongside them are Enforcers, jaded Inspectors that have become latent criminals, granted relative freedom in exchange for carrying out the Inspectors' dirty work.  Into this world steps Akane Tsunemori, a young woman with an honest desire to uphold justice. However, as she works alongside veteran Enforcer Shinya Kougami, she soon learns that the Sibyl System's judgments are not as perfect as her fellow Inspectors assume. With everything she has known turned on its head, Akane wrestles with the question of what justice truly is, and whether it can be upheld through the use of a system that may already be corrupt.  [Written by MAL Rewrite]","{'id_original': 13601, 'episodios': 22}"
5040,One Outs,2008,"['Sports', 'Suspense']",[],8.32,121667,https://cdn.myanimelist.net/images/anime/7/21065.jpg,"Toua Tokuchi is a prodigy when it comes to both baseball and gambling. Pitching nothing but mediocre fastballs, he has made a name for himself by attaining 499 consecutive victories in the game of One Outs: a one-on-one showdown between a pitcher and a batter. Despite his remarkable abilities, however, Tokuchi sees the sport as nothing more than a way to make some quick money.  When Hiromichi Kojima, a legendary hitter for the struggling Saikyou Saitama Lycaons, witnesses Tokuchi's skills firsthand, he realizes that the man might be exactly what the team needs to get out of their slump. Determined to recruit Tokuchi no matter what, Kojima places his own career on the line and defeats Tokuchi at his own specialty—One Outs.  Forced to become a Lycaon, Tokuchi soon finds himself at odds with the team's owner, Tsuneo Saikawa. After Saikawa refuses to give him a reasonable salary, Tokuchi proposes a special contract: pitching an out will earn him five million yen, but giving up a run will cost him fifty million. With every game having the potential to either make or break him, Tokuchi must outwit all who stand in his way.  [Written by MAL Rewrite]","{'id_original': 5040, 'episodios': 25}"
5081,Bakemonogatari,2009,"['Mystery', 'Romance', 'Supernatural']","['Estratégia & Puzzle', 'Sci-Fi & Fantasia', 'Terror & Suspense', 'Drama & Narrativo', 'Romance']",8.32,762831,https://cdn.myanimelist.net/images/anime/11/75274.jpg,"Koyomi Araragi, a third-year high school student, manages to survive a vampire attack with the help of Meme Oshino, a strange man residing in an abandoned building. Though being saved from vampirism and now a human again, several side effects such as superhuman healing abilities and enhanced vision still remain. Regardless, Araragi tries to live the life of a normal student, with the help of his friend and the class president, Tsubasa Hanekawa.  When fellow classmate Hitagi Senjougahara falls down the stairs and is caught by Araragi, the boy realizes that the girl is unnaturally weightless. Despite Senjougahara's protests, Araragi insists he help her, deciding to enlist the aid of Oshino, the very man who had once helped him with his own predicament.  Through several tales involving demons and gods, Bakemonogatari follows Araragi as he attempts to help those who suffer from supernatural maladies.  [Written by MAL Rewrite]","{'id_original': 5081, 'episodios': 15}"
22535,Parasyte: The Maxim,2014,"['Action', 'Horror', 'Sci-Fi', 'Suspense']","['Terror & Suspense', 'Ação & Aventura', 'Sci-Fi & Fantasia']",8.32,1232517,https://cdn.myanimelist.net/images/anime/3/73178.jpg,"All of a sudden, they arrived: parasitic aliens that descended upon Earth and quickly infiltrated humanity by burrowing into the brains of vulnerable targets. These insatiable beings acquire full control of their host and are able to morph into a variety of forms in order to feed on unsuspecting prey.   Sixteen-year-old high school student Shinichi Izumi falls victim to one of these parasites, but it fails to take over his brain, ending up in his right hand instead. Unable to relocate, the parasite, now named Migi, has no choice but to rely on Shinichi in order to stay alive. Thus, the pair is forced into an uneasy coexistence and must defend themselves from hostile parasites that hope to eradicate this new threat to their species.  [Written by MAL Rewrite]","{'id_original': 22535, 'episodios': 24}"
10162,Bunny Drop,2011,['Slice of Life'],['Comédia & Slice of Life'],8.32,253166,https://cdn.myanimelist.net/images/anime/1460/98853.jpg,"Daikichi Kawachi is a 30-year-old bachelor working a respectable job but otherwise wandering aimlessly through life. When his grandfather suddenly passes away, he returns to the family home to pay his respects. Upon arriving at the house, he meets a mysterious young girl named Rin who, to Daikichi’s astonishment, is his grandfather's illegitimate daughter!   The shy and unapproachable girl is deemed an embarrassment to the family, and finds herself ostracized by her father's relatives, all of them refusing to take care of her in the wake of his death. Daikichi, angered by their coldness toward Rin, announces that he will take her in—despite the fact that he is a young, single man with no prior childcare experience.  Usagi Drop is the story of Daikichi's journey through fatherhood as he raises Rin with his gentle and affectionate nature, as well as an exploration of the warmth and interdependence that are at the heart of a happy, close-knit family.  [Written by MAL Rewrite]","{'id_original': 10162, 'episodios': 11}"
2559,Romeo's Blue Skies,1995,"['Adventure', 'Drama']","['Ação & Aventura', 'Drama & Narrativo']",8.31,18878,https://cdn.myanimelist.net/images/anime/4/17979.jpg,"Romeo is a kindhearted and courageous boy living with his family in a small village in Switzerland. Unfortunately, Romeo becomes the interest of a man named Luini, known as ""The God of Death,"" who is infamous for buying children and selling them as chimney sweeps in Milan. While visiting the village, Luini burns down Romeo's family cornfield in an attempt to have Romeo as his own. With the cornfield gone and his father sustaining a head injury trying to put out the fire, Romeo bravely sells himself to the God of Death in order to help his family afford a doctor.   On his way to Milan, Romeo meets a boy named Alfredo Martini and they quickly become friends. Just as Alfredo is sold to a different master, the two boys swear eternal friendship and vow to meet again. As a chimney sweep, Romeo faces many hardships and abuse, especially from his master's family and a gang known as the Wolf Pack. But after reuniting with Alfredo, the two form a fraternity of chimney sweeps called ""The Black Brothers,"" who will learn to fight against the Wolf Pack and help each other in times of need.  [Written by MAL Rewrite]","{'id_original': 2559, 'episodios': 33}"
1210,Welcome to the N.H.K.,2006,"['Comedy', 'Drama', 'Romance']","['Comédia & Slice of Life', 'Romance', 'Drama & Narrativo']",8.31,363454,https://cdn.myanimelist.net/images/anime/3/52675.jpg,"Twenty-two-year-old college dropout Tatsuhiro Satou has been a hikikomori for almost four years now. In his isolation, he has come to believe in many obscure conspiracy theories, but there is one in particular which he holds unshakable faith in: the theory that the evil conspirator behind his shut-in NEET (Not in Employment, Education or Training) status is the Nihon Hikikomori Kyokai (NHK)—an evil and secret organization dedicated to fostering the spread of hikikomori culture.  NHK ni Youkoso! is a psychological dramedy that follows Tatsuhiro as he strives to escape from the NHK's wicked machinations and the disease of self-wrought isolation, while struggling to even just leave his apartment and find a job. His unexpected encounter with the mysterious Misaki Nakahara might signal a reversal of fortune for Tatsuhiro, but with this meeting comes the inevitable cost of having to face his greatest fear—society.  [Written by MAL Rewrite]","{'id_original': 1210, 'episodios': 24}"
4081,Natsume's Book of Friends,2008,"['Slice of Life', 'Supernatural']","['Terror & Suspense', 'Comédia & Slice of Life', 'Sci-Fi & Fantasia']",8.3,197394,https://cdn.myanimelist.net/images/anime/1681/108439.jpg,"Due to an unusual ability to see strange creatures called youkai, Takashi Natsume has never fit in. Passed around from one foster home to another, he was left isolated and lonely. Over time, he has accepted that no one would ever believe him and has closed himself off to his current caretakers and classmates.  When Natsume accidentally breaks an intangible barrier, he frees Madara—a mighty spirit in the form of a lucky cat. Madara notices that Natsume bears a remarkable resemblance to his late grandmother Reiko Natsume, an outcast girl who became known across the youkai world for creating the Book of Friends. It is now in Natsume's possession, along with its power to call upon the written names of the youkai Reiko had defeated.   With no interest in its powers, Natsume decides to keep the book for the sake of his grandmother's memories and to protect it from scheming youkai. Therefore, he makes a deal with Madara: he will hand him the book once his time is up, and in turn, Madara will act as Natsume's unofficial bodyguard, nicknamed Nyanko-sensei. With his newfound goal of freeing those Reiko had sealed, Natsume's relationship with both youkai and humans slowly begins to improve.  [Written by MAL Rewrite]","{'id_original': 4081, 'episodios': 13}"
