id,titulo,ano_lancamento,generos,generos_unificados,rating,num_avaliacoes,imagem,descricao,metadados
52991,Frieren: Beyond Journey's End,2023,"['Adventure', 'Drama', 'Fantasy']","['Drama & Narrativo', 'Sci-Fi & Fantasia', 'Ação & Aventura']",9.29,762723,https://cdn.myanimelist.net/images/anime/1015/138006.jpg,"During their decade-long quest to defeat the Demon King, the members of the hero's party—Himmel himself, the priest Heiter, the dwarf warrior Eisen, and the elven mage Frieren—forge bonds through adventures and battles, creating unforgettable precious memories for most of them.  However, the time that Frieren spends with her comrades is equivalent to merely a fraction of her life, which has lasted over a thousand years. When the party disbands after their victory, Frieren casually returns to her ""usual"" routine of collecting spells across the continent. Due to her different sense of time, she seemingly holds no strong feelings toward the experiences she went through.  As the years pass, Frieren gradually realizes how her days in the hero's party truly impacted her. Witnessing the deaths of two of her former companions, Frieren begins to regret having taken their presence for granted; she vows to better understand humans and create real personal connections. Although the story of that once memorable journey has long ended, a new tale is about to begin.  [Written by MAL Rewrite]","{'id_original': 52991, 'episodios': 28}"
5114,Fullmetal Alchemist: Brotherhood,2009,"['Action', 'Adventure', 'Drama', 'Fantasy']","['Drama & Narrativo', 'Sci-Fi & Fantasia', 'Ação & Aventura']",9.1,2263976,https://cdn.myanimelist.net/images/anime/1208/94745.jpg,"After a horrific alchemy experiment goes wrong in the Elric household, brothers Edward and Alphonse are left in a catastrophic new reality. Ignoring the alchemical principle banning human transmutation, the boys attempted to bring their recently deceased mother back to life. Instead, they suffered brutal personal loss: Alphonse's body disintegrated while Edward lost a leg and then sacrificed an arm to keep Alphonse's soul in the physical realm by binding it to a hulking suit of armor.  The brothers are rescued by their neighbor Pinako Rockbell and her granddaughter Winry. Known as a bio-mechanical engineering prodigy, Winry creates prosthetic limbs for Edward by utilizing ""automail,"" a tough, versatile metal used in robots and combat armor. After years of training, the Elric brothers set off on a quest to restore their bodies by locating the Philosopher's Stone—a powerful gem that allows an alchemist to defy the traditional laws of Equivalent Exchange.  As Edward becomes an infamous alchemist and gains the nickname ""Fullmetal,"" the boys' journey embroils them in a growing conspiracy that threatens the fate of the world.  [Written by MAL Rewrite]","{'id_original': 5114, 'episodios': 64}"
9253,Steins;Gate,2011,"['Drama', 'Sci-Fi', 'Suspense']","['Drama & Narrativo', 'Sci-Fi & Fantasia']",9.07,1491963,https://cdn.myanimelist.net/images/anime/1935/127974.jpg,"Eccentric scientist Rintarou Okabe has a never-ending thirst for scientific exploration. Together with his ditzy but well-meaning friend Mayuri Shiina and his roommate Itaru Hashida, Okabe founds the Future Gadget Laboratory in the hopes of creating technological innovations that baffle the human psyche. Despite claims of grandeur, the only notable ""gadget"" the trio have created is a microwave that has the mystifying power to turn bananas into green goo.  However, when Okabe attends a conference on time travel, he experiences a series of strange events that lead him to believe that there is more to the ""Phone Microwave"" gadget than meets the eye. Apparently able to send text messages into the past using the microwave, Okabe dabbles further with the ""time machine,"" attracting the ire and attention of the mysterious organization SERN.  Due to the novel discovery, Okabe and his friends find themselves in an ever-present danger. As he works to mitigate the damage his invention has caused to the timeline, Okabe fights a battle to not only save his loved ones but also to preserve his degrading sanity.  [Written by MAL Rewrite]","{'id_original': 9253, 'episodios': 24}"
11061,Hunter x Hunter,2011,"['Action', 'Adventure', 'Fantasy']","['Sci-Fi & Fantasia', 'Ação & Aventura']",9.03,1928388,https://cdn.myanimelist.net/images/anime/1337/99013.jpg,"Hunters devote themselves to accomplishing hazardous tasks, all from traversing the world's uncharted territories to locating rare items and monsters. Before becoming a Hunter, one must pass the Hunter Examination—a high-risk selection process in which most applicants end up handicapped or worse, deceased.  Ambitious participants who challenge the notorious exam carry their own reason. What drives 12-year-old Gon Freecss is finding Ging, his father and a Hunter himself. Believing that he will meet his father by becoming a Hunter, Gon takes the first step to walk the same path.  During the Hunter Examination, Gon befriends the medical student Leorio Paladiknight, the vindictive Kurapika, and ex-assassin Killua Zoldyck. While their motives vastly differ from each other, they band together for a common goal and begin to venture into a perilous world.  [Written by MAL Rewrite]","{'id_original': 11061, 'episodios': 148}"
918,Gintama,2006,"['Action', 'Comedy', 'Sci-Fi']","['Comédia & Slice of Life', 'Sci-Fi & Fantasia', 'Ação & Aventura']",8.93,417994,https://cdn.myanimelist.net/images/anime/10/73274.jpg,"Edo is a city that was home to the vigor and ambition of samurai across the country. However, following feudal Japan's surrender to powerful aliens known as the ""Amanto,"" those aspirations now seem unachievable. With the once-influential shogunate rebuilt as a puppet government, a new law is passed that promptly prohibits all swords in public.   Enter Gintoki Sakata, an eccentric silver-haired man who always carries around a wooden sword and maintains his stature as a samurai despite the ban. As the founder of Yorozuya, a small business for odd jobs, Gintoki often embarks on endeavors to help other people—though usually in rather strange and unforeseen ways.   Assisted by Shinpachi Shimura, a boy with glasses supposedly learning the way of the samurai; Kagura, a tomboyish girl with superhuman strength and an endless appetite; and Sadaharu, their giant pet dog who loves biting on people's heads, the Yorozuya encounter anything from alien royalty to scuffles with local gangs in the ever-changing world of Edo.  [Written by MAL Rewrite]","{'id_original': 918, 'episodios': 201}"
19,Monster,2004,"['Drama', 'Mystery', 'Suspense']","['Drama & Narrativo', 'Terror & Suspense', 'Estratégia & Puzzle']",8.89,490111,https://cdn.myanimelist.net/images/anime/10/18793.jpg,"Dr. Kenzou Tenma, an elite neurosurgeon recently engaged to his hospital director's daughter, is well on his way to ascending the hospital hierarchy. That is until one night, a seemingly small event changes Dr. Tenma's life forever. While preparing to perform surgery on someone, he gets a call from the hospital director telling him to switch patients and instead perform life-saving brain surgery on a famous performer. His fellow doctors, fiancée, and the hospital director applaud his accomplishment; but because of the switch, a poor immigrant worker is dead, causing Dr. Tenma to have a crisis of conscience.  So when a similar situation arises, Dr. Tenma stands his ground and chooses to perform surgery on the young boy Johan Liebert instead of the town's mayor. Unfortunately, this choice leads to serious ramifications for Dr. Tenma—losing his social standing being one of them. However, with the mysterious death of the director and two other doctors, Dr. Tenma's position is restored. With no evidence to convict him, he is released and goes on to attain the position of hospital director.   Nine years later when Dr. Tenma saves the life of a criminal, his past comes back to haunt him—once again, he comes face to face with the monster he operated on. He must now embark on a quest of pursuit to make amends for the havoc spread by the one he saved.  [Written by MAL Rewrite]","{'id_original': 19, 'episodios': 74}"
54492,The Apothecary Diaries,2023,"['Drama', 'Mystery']","['Drama & Narrativo', 'Terror & Suspense', 'Estratégia & Puzzle']",8.86,419904,https://cdn.myanimelist.net/images/anime/1708/138033.jpg,"Maomao, an apothecary's daughter, has been plucked from her peaceful life and sold to the lowest echelons of the imperial court. Now merely a maid, Maomao settles into her new mundane life and hides her extensive knowledge of medicine in order to avoid any unwanted attention.  Not long after Maomao's arrival, the emperor's infant children inexplicably begin to experience grave symptoms—almost as if a curse has been cast. The curious Maomao easily solves the mystery and, to remain out of the limelight, attempts to leave an anonymous tip. Unfortunately, the dashing and perceptive eunuch Jinshi sees through it and manages to single her out.  In recognition of her talent, Maomao is promoted to lady-in-waiting for the emperor's favorite concubine, Gyokuyou. As Maomao continues to remedy the numerous ailments afflicting the imperial court, her pharmaceutical expertise quickly proves indispensable.  [Written by MAL Rewrite]","{'id_original': 54492, 'episodios': 24}"
263,Fighting Spirit,2000,['Sports'],[],8.78,331935,https://cdn.myanimelist.net/images/anime/4/86334.jpg,"In his father's absence, teenager Ippo Makunouchi works hard to help his mother run her fishing boat rental business. Ippo's timid nature, his lack of sleep, and the sea smell make him an easy target for relentless bullies who leave him bruised and beaten on a daily basis. Mamoru Takamura, an up-and-coming boxer, rescues Ippo from a violent after-school incident and takes him back to the Kamogawa Boxing Gym for recovery. Takamura and his fellow boxers, Masaru Aoki and Tatsuya Kimura, are stunned by Ippo's powerful punches—a result of strong muscles developed through years serving his physically taxing family business.   Following brief training under Takamura, Ippo impresses the other boxers in a practice match against prodigy Ichirou Miyata. He gains a rival in Miyata and a coach in Genji Kamogawa, the gym owner and a former boxer himself. As Ippo takes the first steps in his official boxing career, he faces off against a series of challenging opponents, each more powerful than the last. Victory, loss, and a cycle of dedicated training await Ippo on his journey to achieve greatness. With his tough body and unstoppable fighting spirit, the kind young man seeks to take on the world.  [Written by MAL Rewrite]","{'id_original': 263, 'episodios': 75}"
37521,Vinland Saga,2019,"['Action', 'Adventure', 'Drama']","['Drama & Narrativo', 'Ação & Aventura']",8.77,1017505,https://cdn.myanimelist.net/images/anime/1500/103005.jpg,"Young Thorfinn grew up listening to the stories of old sailors that had traveled the ocean and reached the place of legend, Vinland. It's said to be warm and fertile, a place where there would be no need for fighting—not at all like the frozen village in Iceland where he was born, and certainly not like his current life as a mercenary. War is his home now. Though his father once told him, ""You have no enemies, nobody does. There is nobody who it's okay to hurt,"" as he grew, Thorfinn knew that nothing was further from the truth.  The war between England and the Danes grows worse with each passing year. Death has become commonplace, and the viking mercenaries are loving every moment of it. Allying with either side will cause a massive swing in the balance of power, and the vikings are happy to make names for themselves and take any spoils they earn along the way. Among the chaos, Thorfinn must take his revenge and kill Askeladd, the man who murdered his father. The only paradise for the vikings, it seems, is the era of war and death that rages on.  [Written by MAL Rewrite]","{'id_original': 37521, 'episodios': 24}"
1,Cowboy Bebop,1998,"['Action', 'Award Winning', 'Sci-Fi']","['Sci-Fi & Fantasia', 'Ação & Aventura']",8.75,1039799,https://cdn.myanimelist.net/images/anime/4/19644.jpg,"Crime is timeless. By the year 2071, humanity has expanded across the galaxy, filling the surface of other planets with settlements like those on Earth. These new societies are plagued by murder, drug use, and theft, and intergalactic outlaws are hunted by a growing number of tough bounty hunters.  Spike Spiegel and Jet Black pursue criminals throughout space to make a humble living. Beneath his goofy and aloof demeanor, Spike is haunted by the weight of his violent past. Meanwhile, Jet manages his own troubled memories while taking care of Spike and the Bebop, their ship. The duo is joined by the beautiful con artist Faye Valentine, odd child Edward Wong Hau Pepelu Tivrusky IV, and Ein, a bioengineered Welsh corgi.  While developing bonds and working to catch a colorful cast of criminals, the Bebop crew's lives are disrupted by a menace from Spike's past. As a rival's maniacal plot continues to unravel, Spike must choose between life with his newfound family or revenge for his old wounds.  [Written by MAL Rewrite]","{'id_original': 1, 'episodios': 26}"
47917,Bocchi the Rock!,2022,['Comedy'],['Comédia & Slice of Life'],8.74,449735,https://cdn.myanimelist.net/images/anime/1448/127956.jpg,"Yearning to make friends and perform live with a band, lonely and socially anxious Hitori ""Bocchi"" Gotou devotes her time to playing the guitar. On a fateful day, Bocchi meets the outgoing drummer Nijika Ijichi, who invites her to join Kessoku Band when their guitarist, Ikuyo Kita, flees before their first show. Soon after, Bocchi meets her final bandmate—the cool bassist Ryou Yamada.   Although their first performance together is subpar, the girls feel empowered by their shared love for music, and they are soon rejoined by Kita. Finding happiness in performing, Bocchi and her bandmates put their hearts into improving as musicians while making the most of their fleeting high school days.  [Written by MAL Rewrite]","{'id_original': 47917, 'episodios': 12}"
21,One Piece,1999,"['Action', 'Adventure', 'Fantasy']","['Sci-Fi & Fantasia', 'Ação & Aventura']",8.73,1482485,https://cdn.myanimelist.net/images/anime/1244/138851.jpg,"Barely surviving in a barrel after passing through a terrible whirlpool at sea, carefree Monkey D. Luffy ends up aboard a ship under attack by fearsome pirates. Despite being a naive-looking teenager, he is not to be underestimated. Unmatched in battle, Luffy is a pirate himself who resolutely pursues the coveted One Piece treasure and the King of the Pirates title that comes with it.  The late King of the Pirates, Gol D. Roger, stirred up the world before his death by disclosing the whereabouts of his hoard of riches and daring everyone to obtain it. Ever since then, countless powerful pirates have sailed dangerous seas for the prized One Piece only to never return. Although Luffy lacks a crew and a proper ship, he is endowed with a superhuman ability and an unbreakable spirit that make him not only a formidable adversary but also an inspiration to many.  As he faces numerous challenges with a big smile on his face, Luffy gathers one-of-a-kind companions to join him in his ambitious endeavor, together embracing perils and wonders on their once-in-a-lifetime adventure.  [Written by MAL Rewrite]","{'id_original': 21, 'episodios': None}"
1575,Code Geass: Lelouch of the Rebellion,2006,"['Award Winning', 'Drama', 'Sci-Fi']","['Sci-Fi & Fantasia', 'Drama & Narrativo']",8.71,1492577,https://cdn.myanimelist.net/images/anime/1032/135088.jpg,"In the year 2010, the Holy Empire of Britannia is establishing itself as a dominant military nation, starting with the conquest of Japan. Renamed to Area 11 after its swift defeat, Japan has seen significant resistance against these tyrants in an attempt to regain independence.  Lelouch Lamperouge, a Britannian student, unfortunately finds himself caught in a crossfire between the Britannian and the Area 11 rebel armed forces. He is able to escape, however, thanks to the timely appearance of a mysterious girl named C.C., who bestows upon him Geass, the ""Power of Kings."" Realizing the vast potential of his newfound ""power of absolute obedience,"" Lelouch embarks upon a perilous journey as the masked vigilante known as Zero, leading a merciless onslaught against Britannia in order to get revenge once and for all.  [Written by MAL Rewrite]","{'id_original': 1575, 'episodios': 25}"
52215,Orb: On the Movements of the Earth,2024,['Drama'],['Drama & Narrativo'],8.7,98964,https://cdn.myanimelist.net/images/anime/1749/145922.jpg,"Twelve-year-old prodigy Rafal believes in living rationally, so as to earn praise and respect from society while not being led astray by his emotions. To this end, he publicly states his intention to study theology—the academic field held in highest regard in early 15th century Poland. However, an encounter with a mysterious man upends Rafal's life, sparking an illogical desire to instead pursue his passion for astronomy.  Rafal is determined to prove the beauty and rationality of heliocentrism—the theory that the Earth revolves around the Sun. This belief is considered heretical by the powerful Church, which promotes geocentrism—the Sun revolving around the Earth—as the sole truth of the universe. Those whose beliefs do not align with the will of the Church suffer unfathomably gruesome consequences.  In pursuit of evidence for a heliocentric model of the universe, Rafal grapples with obtaining precise calculations and building empirical theories. His greatest challenge, however, lies in conducting this research discreetly—lest he wish to meet the same fate as other heretics.  [Written by MAL Rewrite]","{'id_original': 52215, 'episodios': 25}"
33352,Violet Evergarden,2018,['Drama'],['Drama & Narrativo'],8.69,1064653,https://cdn.myanimelist.net/images/anime/1795/95088.jpg,"The Great War finally came to an end after four long years of conflict; fractured in two, the continent of Telesis slowly began to flourish once again. Caught up in the bloodshed was Violet Evergarden, a young girl raised for the sole purpose of decimating enemy lines. Hospitalized and maimed in a bloody skirmish during the War's final leg, she was left with only words from the person she held dearest, but with no understanding of their meaning.  Recovering from her wounds, Violet starts a new life working at CH Postal Services after a falling out with her new intended guardian family. There, she witnesses by pure chance the work of an ""Auto Memory Doll,"" amanuenses that transcribe people's thoughts and feelings into words on paper. Moved by the notion, Violet begins work as an Auto Memory Doll, a trade that will take her on an adventure, one that will reshape the lives of her clients and hopefully lead to self-discovery.  [Written by MAL Rewrite]","{'id_original': 33352, 'episodios': 13}"
245,Great Teacher Onizuka,1999,['Comedy'],['Comédia & Slice of Life'],8.68,440279,https://cdn.myanimelist.net/images/anime/13/11460.jpg,"Twenty-two-year-old Eikichi Onizuka—ex-biker gang leader, conqueror of Shonan, and virgin—has a dream: to become the greatest high school teacher in all of Japan. This isn't because of a passion for teaching, but because he wants a loving teenage wife when he's old and gray. Still, for a perverted, greedy, and lazy delinquent, there is more to Onizuka than meets the eye. So when he lands a job as the homeroom teacher of the Class 3-4 at the prestigious Holy Forest Academy—despite suplexing the Vice Principal—all of his talents are put to the test, as this class is particularly infamous.  Due to their utter contempt for all teachers, the class' students use psychological warfare to mentally break any new homeroom teacher they get, forcing them to quit and leave school. However, Onizuka isn't your average teacher, and he's ready for any challenge in his way.  Bullying, suicide, and sexual harassment are just a few of the issues his students face daily. By tackling the roots of their problems, Onizuka supports them with his unpredictable and unconventional methods—even if it means jumping off a building to save a suicidal child. Thanks to his eccentric charm and fun-loving nature, Class 3-4 slowly learns just how enjoyable school can be when you're the pupils of the Great Teacher Onizuka.  [Written by MAL Rewrite]","{'id_original': 245, 'episodios': 43}"
457,Mushi-Shi,2005,"['Adventure', 'Mystery', 'Slice of Life', 'Supernatural']","['Comédia & Slice of Life', 'Terror & Suspense', 'Estratégia & Puzzle', 'Ação & Aventura', 'Sci-Fi & Fantasia']",8.65,293988,https://cdn.myanimelist.net/images/anime/2/73862.jpg,"""Mushi"": the most basic forms of life in the world. They exist without any goals or purposes aside from simply ""being."" They are beyond the shackles of the words ""good"" and ""evil."" Mushi can exist in countless forms and are capable of mimicking things from the natural world such as plants, diseases, and even phenomena like rainbows.  This is, however, just a vague definition of these entities that inhabit the vibrant world of Mushishi, as to even call them a form of life would be an oversimplification. Detailed information on Mushi is scarce because the majority of humans are unaware of their existence.  So what are Mushi and why do they exist? This is the question that a ""Mushishi,"" Ginko, ponders constantly. Mushishi are those who research Mushi in hopes of understanding their place in the world's hierarchy of life.  Ginko chases rumors of occurrences that could be tied to Mushi, all for the sake of finding an answer.  It could, after all, lead to the meaning of life itself.  [Written by MAL Rewrite]","{'id_original': 457, 'episodios': 26}"
2001,Gurren Lagann,2007,"['Adventure', 'Award Winning', 'Sci-Fi']","['Sci-Fi & Fantasia', 'Ação & Aventura']",8.64,958274,https://cdn.myanimelist.net/images/anime/4/5123.jpg,"Simon and Kamina were born and raised in a deep, underground village, hidden from the fabled surface. Kamina is a free-spirited loose cannon bent on making a name for himself, while Simon is a timid young boy with no real aspirations. One day while excavating the earth, Simon stumbles upon a mysterious object that turns out to be the ignition key to an ancient artifact of war, which the duo dubs Lagann. Using their new weapon, Simon and Kamina fend off a surprise attack from the surface with the help of Yoko Littner, a hot-blooded redhead wielding a massive gun who wanders the world above.  In the aftermath of the battle, the sky is now in plain view, prompting Simon and Kamina to set off on a journey alongside Yoko to explore the wastelands of the surface. Soon, they join the fight against the ""Beastmen,"" humanoid creatures that terrorize the remnants of humanity in powerful robots called ""Gunmen."" Although they face some challenges and setbacks, the trio bravely fights these new enemies alongside other survivors to reclaim the surface, while slowly unraveling a galaxy-sized mystery.  [Written by MAL Rewrite]","{'id_original': 2001, 'episodios': 27}"
23273,Your Lie in April,2014,"['Drama', 'Romance']","['Romance', 'Drama & Narrativo']",8.64,1441841,https://cdn.myanimelist.net/images/anime/1405/143284.jpg,"Kousei Arima is a child prodigy known as the ""Human Metronome"" for playing the piano with precision and perfection. Guided by a strict mother and rigorous training, Kousei dominates every competition he enters, earning the admiration of his musical peers and praise from audiences. When his mother suddenly passes away, the subsequent trauma makes him unable to hear the sound of a piano, and he never takes the stage thereafter.  Nowadays, Kousei lives a quiet and unassuming life as a junior high school student alongside his friends Tsubaki Sawabe and Ryouta Watari. While struggling to get over his mother's death, he continues to cling to music. His monochrome life turns upside down the day he encounters the eccentric violinist Kaori Miyazono, who thrusts him back into the spotlight as her accompanist. Through a little lie, these two young musicians grow closer together as Kaori tries to fill Kousei's world with color.  [Written by MAL Rewrite]","{'id_original': 23273, 'episodios': 22}"
59845,The Fragrant Flower Blooms with Dignity,2025,"['Drama', 'Romance']","['Romance', 'Drama & Narrativo']",8.63,148861,https://cdn.myanimelist.net/images/anime/1744/150433.jpg,"The all-girls Kikyo Private Academy and Chidori Public High School are polar opposites. With its prestigious history, Kikyo is attended by noble young ladies from distinguished families, while Chidori is infamously full of simple-minded delinquents. It is no surprise that their students clash with their differences.  Having a tall stature and fierce appearance, Chidori student Rintarou Tsumugi is often avoided by others despite his gentle heart. One day, while helping out at his family's patisserie, he meets a customer who, after a brief moment, runs away from him. The next day, the customer returns to apologize to Rintarou, introducing herself as the cheerful Kaoruko Waguri.  After spending time with Kaoruko, Rintarou appreciates that she does not judge him based on his appearance and looks forward to when they will meet again. However, when Rintarou discovers Kaoruko attends Kikyo, their relationship will challenge the social expectations and dynamics around them.  [Written by MAL Rewrite]","{'id_original': 59845, 'episodios': 13}"
