id,titulo,ano_lancamento,generos,generos_unificados,rating,num_avaliacoes,imagem,descricao,metadados
34599,Made in Abyss,2017,"['Adventure', 'Drama', 'Fantasy', 'Mystery', 'Sci-Fi']","['Terror & Suspense', 'Estratégia & Puzzle', 'Ação & Aventura', 'Sci-Fi & Fantasia', 'Drama & Narrativo']",8.63,818938,https://cdn.myanimelist.net/images/anime/6/86733.jpg,"The Abyss—a gaping chasm stretching down into the depths of the earth, filled with mysterious creatures and relics from a time long past. How did it come to be? What lies at the bottom? Countless brave individuals, known as Divers, have sought to solve these mysteries of the Abyss, fearlessly descending into its darkest realms. The best and bravest of the Divers, the White Whistles, are hailed as legends by those who remain on the surface.  Riko, daughter of the missing White Whistle Lyza the Annihilator, aspires to become like her mother and explore the furthest reaches of the Abyss. However, just a novice Red Whistle herself, she is only permitted to roam its most upper layer. Even so, Riko has a chance encounter with a mysterious robot with the appearance of an ordinary young boy. She comes to name him Reg, and he has no recollection of the events preceding his discovery. Certain that the technology to create Reg must come from deep within the Abyss, the two decide to venture forth into the chasm to recover his memories and see the bottom of the great pit with their own eyes. However, they know not of the harsh reality that is the true existence of the Abyss.  [Written by MAL Rewrite]","{'id_original': 34599, 'episodios': 13}"
22135,Ping Pong the Animation,2014,"['Award Winning', 'Drama', 'Sports']",['Drama & Narrativo'],8.63,199788,https://cdn.myanimelist.net/images/anime/1586/146565.jpg,"Despite being polar opposites, Makoto ""Smile"" Tsukimoto and Yutaka ""Peco"" Hoshino have been best friends since childhood. Although the overly confident Peco strives to be the best ping-pong player in the world, he often skips practice, earning the ire of his fellow teammates on the Katase High School ping-pong team. Meanwhile, Smile—in spite of his innate talent for the sport—cannot help but hold back his full strength when playing against others. Through their mutual love for ping-pong, the two have developed a bond that is seemingly unbreakable.  When Peco hears that an ex-national team player from China is coming to Japan, he drags Smile over to rival Tsujido High School to observe them. The subsequent trip leads to a clash between Peco and Kong Wenge, who overwhelmingly defeats the former in one game. Stunned by such a comprehensive loss, Peco finds himself questioning why he plays to begin with. Seeing his potential as a player, Katase's coach begins to train Smile to overcome his hesitation, but he is reluctant to play if it is not for enjoyment.  As the two struggle to find meaning in the sport, a plethora of stronger players—each with their own internal strifes—await them at the inter-high tournament, where only the very best can persevere. But when these young athletes let their unbridled ambition go unchecked, the hardships they face paint a somber reality as they pursue glory.  [Written by MAL Rewrite]","{'id_original': 22135, 'episodios': 11}"
46102,Odd Taxi,2021,"['Award Winning', 'Drama', 'Mystery', 'Suspense']","['Terror & Suspense', 'Estratégia & Puzzle', 'Drama & Narrativo']",8.63,243341,https://cdn.myanimelist.net/images/anime/1981/113348.jpg,"Eccentric and blunt, the walrus Hiroshi Odokawa lives a relatively normal life. He drives a taxi for a living, and there he meets several unique individuals: the jobless Taichi Kabasawa who is dead-set on going viral, the mysterious nurse Miho Shirakawa, the struggling comedic duo ""Homo Sapiens,"" and Dobu, a well-known delinquent.  But Odokawa's simple way of life is about to be turned upside down. The case of a missing girl the police have been tracking leads back to him, and now both the yakuza and a duo of corrupt cops are on his tail.  [Written by MAL Rewrite]","{'id_original': 46102, 'episodios': 13}"
1535,Death Note,2006,"['Supernatural', 'Suspense']","['Sci-Fi & Fantasia', 'Terror & Suspense']",8.62,2939952,https://cdn.myanimelist.net/images/anime/1079/138100.jpg,"Brutal murders, petty thefts, and senseless violence pollute the human world. In contrast, the realm of death gods is a humdrum, unchanging gambling den. The ingenious 17-year-old Japanese student Light Yagami and sadistic god of death Ryuk share one belief: their worlds are rotten.  For his own amusement, Ryuk drops his Death Note into the human world. Light stumbles upon it, deeming the first of its rules ridiculous: the human whose name is written in this note shall die. However, the temptation is too great, and Light experiments by writing a felon's name, which disturbingly enacts his first murder.  Aware of the terrifying godlike power that has fallen into his hands, Light—under the alias Kira—follows his wicked sense of justice with the ultimate goal of cleansing the world of all evil-doers. The meticulous mastermind detective L is already on his trail, but as Light's brilliance rivals L's, the grand chase for Kira turns into an intense battle of wits that can only end when one of them is dead.  [Written by MAL Rewrite]","{'id_original': 1535, 'episodios': 37}"
33,Berserk,1997,"['Action', 'Adventure', 'Drama', 'Fantasy', 'Horror']","['Drama & Narrativo', 'Sci-Fi & Fantasia', 'Ação & Aventura', 'Terror & Suspense']",8.61,400134,https://cdn.myanimelist.net/images/anime/1384/119988.jpg,"Guts, a man who will one day be known as the Black Swordsman, is a young traveling mercenary characterized by the large greatsword he carries. He accepts jobs that offer the most money, but he never stays with one group for long—until he encounters the Band of the Falcon. Ambushed after completing a job, Guts crushes many of its members in combat. Griffith, The Band of the Falcon's leader and founder, takes an interest in Guts and duels him. While the others are no match for Guts, Griffith defeats him in one blow.  Incapacitated and taken into the Band of the Falcon's camp to recover, Guts wakes up two days later. He confronts Griffith, and the two duel yet again, only this time with a condition: Guts will join the Band of the Falcon if he loses. Due to his fresh injuries, Guts loses the fight and is inducted by Griffith.  In three years' time, Guts has become one of the Band of the Falcon's commanders. On the battlefield, his combat prowess is second only to Griffith as he takes on large groups of enemies all on his own. With Guts' immense strength and Griffith's leadership, the Band of the Falcon dominate every battle they partake in. But something menacing lurks in the shadows, threatening to change Guts' life forever.  [Written by MAL Rewrite]","{'id_original': 33, 'episodios': 25}"
52701,Delicious in Dungeon,2024,"['Adventure', 'Comedy', 'Fantasy', 'Gourmet']","['Sci-Fi & Fantasia', 'Ação & Aventura', 'Comédia & Slice of Life']",8.59,274050,https://cdn.myanimelist.net/images/anime/1711/142478.jpg,"Adventuring knight Laios Touden leads a small party through a seemingly endless dungeon, a subterranean maze full of dangerous monsters and precarious traps. Through the use of advanced magic, an explorer can sometimes be resurrected, allowing them to learn from past mistakes and give traversing the dungeon another go. However, when a powerful dragon eats Falin, Laios' spellcasting sister, she sends her brother and his companions back to the beginning to save them from permanent ends.  Though strapped for cash and equipment, Laios resolves to fight his way through the dungeon and rescue Falin before she can be digested by the dragon. Despite some of Laios' allies abandoning him, two remain by his side: elven mage Marcille Donato and halfling locksmith Chilchuck Tims. Due to their lack of funds, the party faces the daunting prospect of starving before being able to complete their quest. However, they find salvation in Senshi, a dwarven warrior with a penchant for cooking and safely eating defeated monsters.  With Senshi's culinary expertise, Laios and his companions struggle through the dungeon while learning about gourmet dining—and each other—along the way.  [Written by MAL Rewrite]","{'id_original': 52701, 'episodios': 24}"
16498,Attack on Titan,2013,"['Action', 'Award Winning', 'Drama', 'Suspense']","['Drama & Narrativo', 'Ação & Aventura']",8.57,3000370,https://cdn.myanimelist.net/images/anime/10/47347.jpg,"Centuries ago, mankind was slaughtered to near extinction by monstrous humanoid creatures called Titans, forcing humans to hide in fear behind enormous concentric walls. What makes these giants truly terrifying is that their taste for human flesh is not born out of hunger but what appears to be out of pleasure. To ensure their survival, the remnants of humanity began living within defensive barriers, resulting in one hundred years without a single titan encounter. However, that fragile calm is soon shattered when a colossal Titan manages to breach the supposedly impregnable outer wall, reigniting the fight for survival against the man-eating abominations.  After witnessing a horrific personal loss at the hands of the invading creatures, Eren Yeager dedicates his life to their eradication by enlisting into the Survey Corps, an elite military unit that combats the merciless humanoids outside the protection of the walls. Eren, his adopted sister Mikasa Ackerman, and his childhood friend Armin Arlert join the brutal war against the Titans and race to discover a way of defeating them before the last walls are breached.  [Written by MAL Rewrite]","{'id_original': 16498, 'episodios': 25}"
877,Nana,2006,"['Drama', 'Romance']","['Drama & Narrativo', 'Romance']",8.57,292855,https://cdn.myanimelist.net/images/anime/2/11232.jpg,"Departing from their respective hometowns, two young women with identical names are brought together in their pursuit of new beginnings. With their hearts set on going to Tokyo, Nana Komatsu dreams about blissful love, while Nana Osaki aims for a successful music career.  The former has a cheerful and friendly nature, but her naivety has steered her romantic life astray until she meets her dependable boyfriend—Shouji Endo. Without letting herself be dismayed by Shouji's decision to study in Tokyo, Nana works hard to earn enough money and follow him there. Meanwhile, her namesake is a solitary punk vocalist whose impassioned romance with her band's bassist, Ren Honjou, comes to a sudden end. Though heartbroken, Nana bravely looks forward and travels to the capital with the ambition of becoming a recognized artist.  Shortly after they arrive in Tokyo, the girls cross paths again due to an unexpected coincidence that ultimately leads them to live under the same roof. As they grow closer, the two strive to support one another amid their struggles to forge a future for themselves.  [Written by MAL Rewrite]","{'id_original': 877, 'episodios': 47}"
52034,[Oshi No Ko],2023,"['Award Winning', 'Drama']",['Drama & Narrativo'],8.55,588597,https://cdn.myanimelist.net/images/anime/1812/134736.jpg,"In the entertainment world, celebrities often show exaggerated versions of themselves to the public, concealing their true thoughts and struggles beneath elaborate lies. Fans buy into these fabrications, showering their idols with undying love and support, until something breaks the illusion. Sixteen-year-old rising star Ai Hoshino of pop idol group B Komachi has the world captivated; however, when she announces a hiatus due to health concerns, the news causes many to become worried.  As a huge fan of Ai, gynecologist Gorou Amemiya cheers her on from his countryside medical practice, wishing he could meet her in person one day. His wish comes true when Ai shows up at his hospital—not sick, but pregnant with twins! While the doctor promises Ai to safely deliver her children, he wonders if this encounter with the idol will forever change the nature of his relationship with her.  [Written by MAL Rewrite]","{'id_original': 52034, 'episodios': 11}"
30484,Steins;Gate 0,2018,"['Drama', 'Sci-Fi', 'Suspense']","['Drama & Narrativo', 'Sci-Fi & Fantasia']",8.55,463448,https://cdn.myanimelist.net/images/anime/1375/93521.jpg,"The eccentric, self-proclaimed mad scientist Rintarou Okabe has become a shell of his former self. Depressed and traumatized after failing to rescue his friend Makise Kurisu, he has decided to forsake his mad scientist alter ego and live as an ordinary college student. Surrounded by friends who know little of his time travel experiences, Okabe spends his days trying to forget the horrors of his adventures alone.   While working as a receptionist at a college technology forum, Okabe meets the short, spunky Maho Hiyajo, who  later turns out to be the interpreter at the forum's presentation, conducted by Professor Alexis Leskinen. In front of a stunned crowd, Alexis and Maho unveil Amadeus—a revolutionary AI capable of storing a person's memories and creating a perfect simulation of that person complete with their personality and quirks. Meeting with Maho and Alexis after the presentation, Okabe learns that the two were Kurisu's colleagues in university, and that they have simulated her in Amadeus. Hired by Alexis to research the simulation's behavior, Okabe is given the chance to interact with the shadow of a long-lost dear friend. Dangerously tangled in the past, Okabe must face the harsh reality and carefully maneuver around the disastrous consequences that come with disturbing the natural flow of time.  [Written by MAL Rewrite]","{'id_original': 30484, 'episodios': 23}"
7785,The Tatami Galaxy,2010,"['Award Winning', 'Comedy', 'Mystery', 'Romance', 'Suspense']","['Drama & Narrativo', 'Estratégia & Puzzle', 'Comédia & Slice of Life', 'Romance', 'Terror & Suspense']",8.55,154442,https://cdn.myanimelist.net/images/anime/1633/123689.jpg,"One autumn evening at a mysterious ramen stand behind the Shimogamo Shrine, a lonely third-year college student bumps into a man with an eggplant-shaped head who calls himself a god of matrimony. Meeting this man causes the student to reflect upon his past two years at college—two years bitterly spent trying to break up couples on campus with his only friend Ozu, a ghoulish-looking man seemingly set on making his life as miserable as possible. Resolving to make the most out of the rest of his college life, the student attempts to ask out the unsociable but kind-hearted underclassman Akashi, yet fails to follow through, prompting him to regret not living out his college life differently. As soon as this thought passes through his head, however, he is hurtled through time and space to the beginning of his years at college and given another chance to live his life.  Surreal, artistic, and mind-bending, Yojouhan Shinwa Taikei chronicles the misadventures of a young man on a journey to make friends, find love, and experience the rose-colored campus life he always dreamed of.  [Written by MAL Rewrite]","{'id_original': 7785, 'episodios': 11}"
170,Slam Dunk,1993,['Sports'],[],8.55,148672,https://cdn.myanimelist.net/images/anime/12/86890.jpg,"Hanamichi Sakuragi, infamous for his temper, massive height, and fire-red hair, enrolls in Shohoku High, hoping to finally get a girlfriend and break his record of being rejected 50 consecutive times in middle school. His notoriety precedes him, however, leading to him being avoided by most students. Soon, after certain events, Hanamichi is left with two unwavering thoughts: ""I hate basketball,"" and ""I desperately need a girlfriend.""  One day, a girl named Haruko Akagi approaches him without any knowledge of his troublemaking ways and asks him if he likes basketball. Hanamichi immediately falls head over heels in love with her, blurting out a fervent affirmative. She then leads him to the gymnasium, where she asks him if he can do a slam dunk. In an attempt to impress Haruko, he makes the leap, but overshoots, instead slamming his head straight into the blackboard. When Haruko informs the basketball team's captain of Hanamichi's near-inhuman physical capabilities, he slowly finds himself drawn into the camaraderie and competition of the sport he had previously held resentment for.  [Written by MAL Rewrite]","{'id_original': 170, 'episodios': 101}"
28735,Showa Genroku Rakugo Shinju,2016,['Drama'],['Drama & Narrativo'],8.54,98574,https://cdn.myanimelist.net/images/anime/1354/124768.jpg,"Yotarou is a former yakuza member fresh out of prison and fixated on just one thing: rather than return to a life of crime, the young man aspires to take to the stage of rakugo, a traditional Japanese form of comedic storytelling. Inspired during his incarceration by the performance of distinguished practitioner Yakumo Yuurakutei, he sets his mind on meeting the man who changed his life. After hearing Yotarou's desperate appeal for his mentorship, Yakumo is left with no choice but to accept his very first apprentice.  As he eagerly begins his training, Yotarou meets Konatsu, an abrasive young woman who has been under Yakumo's care ever since her beloved father Sukeroku Yuurakutei, another prolific rakugo performer, passed away. Through her hidden passion, Yotarou is drawn to Sukeroku's unique style of rakugo despite learning under contrasting techniques. Upon seeing this, old memories and feelings return to Yakumo who reminisces about a much earlier time when he made a promise with his greatest rival.  Shouwa Genroku Rakugo Shinjuu is a story set in both the past and present, depicting the art of rakugo, the relationships it creates, and the lives and hearts of those dedicated to keeping the unique form of storytelling alive.  [Written by MAL Rewrite]","{'id_original': 28735, 'episodios': 13}"
40748,Jujutsu Kaisen,2020,"['Action', 'Award Winning', 'Supernatural']","['Sci-Fi & Fantasia', 'Ação & Aventura', 'Terror & Suspense']",8.53,1917338,https://cdn.myanimelist.net/images/anime/1171/109222.jpg,"Idly indulging in baseless paranormal activities with the Occult Club, high schooler Yuuji Itadori spends his days at either the clubroom or the hospital, where he visits his bedridden grandfather. However, this leisurely lifestyle soon takes a turn for the strange when he unknowingly encounters a cursed item. Triggering a chain of supernatural occurrences, Yuuji finds himself suddenly thrust into the world of Curses—dreadful beings formed from human malice and negativity—after swallowing the said item, revealed to be a finger belonging to the demon Sukuna Ryoumen, the King of Curses.  Yuuji experiences first-hand the threat these Curses pose to society as he discovers his own newfound powers. Introduced to the Tokyo Prefectural Jujutsu High School, he begins to walk down a path from which he cannot return—the path of a Jujutsu sorcerer.  [Written by MAL Rewrite]","{'id_original': 40748, 'episodios': 24}"
205,Samurai Champloo,2004,"['Action', 'Adventure', 'Comedy']","['Ação & Aventura', 'Comédia & Slice of Life']",8.52,675708,https://cdn.myanimelist.net/images/anime/1370/135212.jpg,"Fuu Kasumi is a young and clumsy waitress who spends her days peacefully working in a small teahouse. That is, until she accidentally spills a drink all over one of her customers! With a group of samurai now incessantly harassing her, Fuu desperately calls upon another samurai in the shop, Mugen, who quickly defeats them with his wild fighting technique, utilizing movements reminiscent to that of breakdancing. Unfortunately, Mugen decides to pick a fight with the unwilling ronin Jin, who wields a more precise and traditional style of swordfighting, and the latter proves to be a formidable opponent. The only problem is, they end up destroying the entire shop as well as accidentally killing the local magistrate's son.  For their crime, the two samurai are captured and set to be executed. However, they are rescued by Fuu, who hires the duo as her bodyguards. Though she no longer has a place to return to, the former waitress wishes to find a certain samurai who smells of sunflowers and enlists the help of the now exonerated pair to do so. Despite initially disapproving of this idea, the two eventually agree to assist the girl in her quest; thus, the trio embark upon an adventure to find this mysterious warrior—that is, if Fuu can keep Mugen and Jin from killing each other.  Set in an alternate Edo Period of Japan, Samurai Champloo follows the journey of these three eccentric individuals in an epic quest full of action, comedy, and dynamic sword fighting, all set to the beat of a unique hip-hop infused soundtrack.  [Written by MAL Rewrite]","{'id_original': 205, 'episodios': 26}"
35839,A Place Further Than The Universe,2018,"['Adventure', 'Comedy', 'Drama']","['Drama & Narrativo', 'Ação & Aventura', 'Comédia & Slice of Life']",8.5,232620,https://cdn.myanimelist.net/images/anime/6/89879.jpg,"Filled with an overwhelming sense of wonder for the world around her, Mari Tamaki has always dreamt of what lies beyond the reaches of the universe. However, despite harboring such large aspirations on the inside, her fear of the unknown and anxiety over her own possible limitations have always held her back from chasing them. But now, in her second year of high school, Mari is more determined than ever to not let any more of her youth go to waste. Still, her fear continues to prevent her from taking that ambitious step forward—that is, until she has a chance encounter with a girl who has grand dreams of her own.  Spurred by her mother's disappearance, Shirase Kobuchizawa has been working hard to fund her trip to Antarctica. Despite facing doubt and ridicule from virtually everyone, Shirase is determined to embark on this expedition to search for her mother in a place further than the universe itself. Inspired by Shirase's resolve, Mari jumps at the chance to join her. Soon, their efforts attract the attention of the bubbly Hinata Miyake, who is eager to stand out, and Yuzuki Shiraishi, a polite girl from a high class background. Together, the four spirited girls set sail toward the frozen south, all in search of something great.  [Written by MAL Rewrite]","{'id_original': 35839, 'episodios': 13}"
32182,Mob Psycho 100,2016,"['Action', 'Comedy', 'Supernatural']","['Terror & Suspense', 'Sci-Fi & Fantasia', 'Ação & Aventura', 'Comédia & Slice of Life']",8.49,1388434,https://cdn.myanimelist.net/images/anime/8/80356.jpg,"Eighth-grader Shigeo ""Mob"" Kageyama has tapped into his inner wellspring of psychic prowess at a young age. But the power quickly proves to be a liability when he realizes the potential danger in his skills. Choosing to suppress his power, Mob's only present use for his ability is to impress his longtime crush, Tsubomi, who soon grows bored of the same tricks.  In order to effectuate control on his skills, Mob enlists himself under the wing of Arataka Reigen, a con artist claiming to be a psychic, who exploits Mob's powers for pocket change. Now, exorcising evil spirits on command has become a part of Mob's daily, monotonous life. However, the psychic energy he exerts is barely the tip of the iceberg; if his vast potential and unrestrained emotions run berserk, a cataclysmic event that would render him completely unrecognizable will be triggered. The progression toward Mob's explosion is rising and attempting to stop it is futile.  [Written by MAL Rewrite]","{'id_original': 32182, 'episodios': 12}"
40834,Ranking of Kings,2021,"['Adventure', 'Fantasy']","['Sci-Fi & Fantasia', 'Ação & Aventura']",8.49,387499,https://cdn.myanimelist.net/images/anime/1347/117616.jpg,"The people of the kingdom look down on the young Prince Bojji, who can neither hear nor speak. They call him ""The Useless Prince"" while jeering at his supposed foolishness.  However, while Bojji may not be physically strong, he is certainly not weak of heart. When a chance encounter with a shadow creature should have left him traumatized, it instead makes him believe that he has found a friend amidst those who only choose to notice his shortcomings. He starts meeting with Kage, the shadow, regularly, to the point where even the otherwise abrasive creature begins to warm up to him.  Kage and Bojji's unlikely friendship lays the budding foundations of the prince's journey, one where he intends to conquer his fears and insecurities. Despite the constant ridicule he faces, Bojji resolves to fulfill his desire of becoming the best king he can be.  [Written by MAL Rewrite]","{'id_original': 40834, 'episodios': 23}"
12431,Space Brothers,2012,['Comedy'],['Comédia & Slice of Life'],8.48,55473,https://cdn.myanimelist.net/images/anime/1290/135694.jpg,"On a fateful summer night in 2006, Mutta Nanba and his younger brother Hibito witness what they believe to be a UFO flying toward the Moon. This impressing and unusual phenomenon leads both siblings vowing to become astronauts, with Hibito aiming for the Moon and Mutta, convinced that the eldest brother has to be one step ahead, for Mars.  Now an adult, life hasn't turned out how Mutta had pictured it: he is diligently working in an automotive company, whereas Hibito is on his way to be the very first Japanese man to step on the Moon. However, after losing his job, Mutta is presented with an unexpected opportunity to catch up to his younger brother when the Japanese Aerospace Exploration Agency, commonly known as JAXA, accepts his application to participate in the next astronaut selection. Despite self-doubts about his prospects, Mutta is unwilling to waste this chance of a lifetime, and thus embarks on an ambitious journey to fulfill the promise made 19 years ago.  [Written by MAL Rewrite]","{'id_original': 12431, 'episodios': 99}"
