id,titulo,ano_lancamento,generos,generos_unificados,rating,num_avaliacoes,imagem,descricao,metadados
30276,One-Punch Man,2015,"['Action', 'Comedy']","['Ação & Aventura', 'Comédia & Slice of Life']",8.48,2381043,https://cdn.myanimelist.net/images/anime/12/76049.jpg,"The seemingly unimpressive Saitama has a rather unique hobby: being a hero. In order to pursue his childhood dream, Saitama relentlessly trained for three years, losing all of his hair in the process. Now, Saitama is so powerful, he can defeat any enemy with just one punch. However, having no one capable of matching his strength has led Saitama to an unexpected problem—he is no longer able to enjoy the thrill of battling and has become quite bored.  One day, Saitama catches the attention of 19-year-old cyborg Genos, who witnesses his power and wishes to become Saitama's disciple. Genos proposes that the two join the Hero Association in order to become certified heroes that will be recognized for their positive contributions to society. Saitama, who is shocked that no one knows who he is, quickly agrees. Meeting new allies and taking on new foes, Saitama embarks on a new journey as a member of the Hero Association to experience the excitement of battle he once felt.  [Written by MAL Rewrite]","{'id_original': 30276, 'episodios': 12}"
37779,The Promised Neverland,2019,"['Mystery', 'Suspense']","['Estratégia & Puzzle', 'Terror & Suspense']",8.47,1373708,https://cdn.myanimelist.net/images/anime/1830/118780.jpg,"Surrounded by a forest and a gated entrance, the Grace Field House is inhabited by orphans happily living together as one big family, looked after by their ""Mama,"" Isabella. Although they are required to take tests daily, the children are free to spend their time as they see fit, usually playing outside, as long as they do not venture too far from the orphanage—a rule they are expected to follow no matter what. However, all good times must come to an end, as every few months, a child is adopted and sent to live with their new family, never to be heard from again.  However, the three oldest siblings have their suspicions about what is actually happening at the orphanage, and they are about to discover the cruel fate that awaits the children living at Grace Field, including the twisted nature of their beloved Mama.  [Written by MAL Rewrite]","{'id_original': 37779, 'episodios': 12}"
47194,Summer Time Rendering,2022,"['Mystery', 'Supernatural', 'Suspense']","['Estratégia & Puzzle', 'Sci-Fi & Fantasia', 'Terror & Suspense']",8.47,277967,https://cdn.myanimelist.net/images/anime/1120/120796.jpg,"Since the death of his parents, Shinpei Ajiro had lived with the Kofune family and their two daughters—Mio and Ushio. Although he then left his home island to continue his education in Tokyo, Shinpei returns after Ushio tragically drowns during the attempted rescue of a little girl. During the funeral, his best friend informs him about bruises found around Ushio's neck, casting doubt over the cause of her death.  Suspecting a murder has taken place, Shinpei reevaluates recent events, but strange incidents only continue to transpire. Disappearing people and other unexplainable occurrences lead Mio to recall an old folktale referring to entities called ""Shadows,"" which may not be entirely fantasy. Supposedly, an encounter with one's Shadow foretells the person's impending demise.  Facing the dark side of Hitogashima Island, Shinpei stands against his grim fate to fulfill Ushio's final will—to protect Mio.  [Written by MAL Rewrite]","{'id_original': 47194, 'episodios': 25}"
10165,Nichijou - My Ordinary Life,2011,['Comedy'],['Comédia & Slice of Life'],8.47,394644,https://cdn.myanimelist.net/images/anime/3/75617.jpg,"Nichijou primarily focuses on the daily antics of a trio of childhood friends—high school girls Mio Naganohara, Yuuko Aioi and Mai Minakami—whose stories soon intertwine with the young genius Hakase Shinonome, her robot caretaker Nano, and their talking cat Sakamoto. With every passing day, the lives of these six, as well as of the many people around them, experience both the calms of normal life and the insanity of the absurd. Walking to school, being bitten by a talking crow, spending time with friends, and watching the principal suplex a deer: they are all in a day's work in the extraordinary everyday lives of those in Nichijou.   [Written by MAL Rewrite]","{'id_original': 10165, 'episodios': 26}"
50250,Chiikawa,2022,['Slice of Life'],['Comédia & Slice of Life'],8.46,4138,https://cdn.myanimelist.net/images/anime/1783/121944.jpg,"What's a Chiikawa? No one really knows, but everyone can see they're small, they're cute, and they're always having a fun time! Join them as they explore their surreal world with the sharp humor and clever antics that make the Chiikawa irresistible.  (Source: HIDIVE, edited)","{'id_original': 50250, 'episodios': None}"
6114,Rainbow,2010,"['Drama', 'Suspense']",['Drama & Narrativo'],8.46,165290,https://cdn.myanimelist.net/images/anime/9/72697.jpg,"Japan, 1955: Mario Minakami has just arrived at Shounan Special Reform School along with five other teenagers who have been arrested on serious criminal charges. All assigned to the same cell, they meet older inmate Rokurouta Sakuragi—a former boxer—with whom they establish a close bond. Under his guidance, and with the promise that they will meet again on the outside after serving their sentences, the delinquents begin to view their hopeless situation in a better light.  The seven cellmates struggle together against the brutal suffering and humiliation inflicted upon them by Ishihara, a sadistic guard with a grudge on Rokurouta, and Gisuke Sasaki, a doctor who takes pleasure in violating boys. Facing such hellish conditions, the seven inmates must scrape together all the strength they have to survive until their sentences are up; but even if they do, just what kind of lives are waiting for them on the other side?  [Written by MAL Rewrite]","{'id_original': 6114, 'episodios': 26}"
392,Yu Yu Hakusho: Ghost Files,1992,"['Action', 'Supernatural']","['Sci-Fi & Fantasia', 'Ação & Aventura', 'Terror & Suspense']",8.46,352667,https://cdn.myanimelist.net/images/anime/1228/111372.jpg,"One fateful day, Yuusuke Urameshi, a 14-year-old delinquent with a dim future, gets a miraculous chance to turn it all around when he throws himself in front of a moving car to save a young boy. His ultimate sacrifice is so out of character that the authorities of the spirit realm are not yet prepared to let him pass on. Koenma, heir to the throne of the spirit realm, offers Yuusuke an opportunity to regain his life through completion of a series of tasks. With the guidance of the death god Botan, he is to thwart evil presences on Earth as a Spirit Detective.  To help him on his venture, Yuusuke enlists ex-rival Kazuma Kuwabara, and two demons, Hiei and Kurama, who have criminal pasts. Together, they train and battle against enemies who would threaten humanity's very existence.  [Written by MAL Rewrite]","{'id_original': 392, 'episodios': 112}"
57334,Dan Da Dan,2024,"['Action', 'Comedy', 'Supernatural']","['Terror & Suspense', 'Sci-Fi & Fantasia', 'Ação & Aventura', 'Comédia & Slice of Life']",8.45,529982,https://cdn.myanimelist.net/images/anime/1584/143719.jpg,"Reeling from her recent breakup, Momo Ayase, a popular high schooler, shows kindness to her socially awkward schoolmate, Ken Takakura, by standing up to his bullies. Takakura misunderstands her intentions, believing he has made a new friend who shares his obsession with aliens and UFOs. However, Momo's own eccentric occult beliefs lie in the supernatural realm; she thinks aliens do not exist. A rivalry quickly brews as each becomes determined to prove the other wrong.  Despite their initial clash over their opposing beliefs, Momo and Takakura form an unexpected but intimate friendship, a bond forged in a series of supernatural battles and bizarre encounters with urban legends and paranormal entities. As both develop unique superhuman abilities, they learn to supplement each other's weaknesses, leading them to wonder if their newfound partnership may be about more than just survival.  [Written by MAL Rewrite]","{'id_original': 57334, 'episodios': 12}"
36649,Banana Fish,2018,"['Action', 'Adventure', 'Drama', 'Suspense']","['Drama & Narrativo', 'Ação & Aventura']",8.45,405834,https://cdn.myanimelist.net/images/anime/1190/93472.jpg,"Aslan Jade Callenreese, known as Ash Lynx, was a runaway picked off the streets of New York City and raised by the infamous godfather of the mafia, Dino Golzine. Now 17 years old and the boss of his own gang, Ash begins investigating the mysterious ""Banana Fish""—the same two words his older brother, Griffin, has muttered since his return from the Iraq War. However, his inquiries are hindered when Dino sends his men after Ash at an underground bar he uses as a hideout.  At the bar, Skip, Ash's friend, introduces him to Shunichi Ibe and his assistant, Eiji Okumura, who are Japanese photographers reporting on American street gangs. However, their conversation is interrupted when Shorter Wong, one of Ash's allies, calls to warn him about Dino. Soon, Dino's men storm the bar, and in the ensuing chaos kidnap Skip and Eiji. Now, Ash must find a way to rescue them and continue his investigation into Banana Fish, but will his history with the mafia prevent him from succeeding?  [Written by MAL Rewrite]","{'id_original': 36649, 'episodios': 24}"
37105,Grand Blue Dreaming,2018,['Comedy'],['Comédia & Slice of Life'],8.45,469794,https://cdn.myanimelist.net/images/anime/1302/94882.jpg,"Iori Kitahara moves to the coastal town of Izu for his freshman year at its university, taking residence above Grand Blue, his uncle's scuba diving shop. Iori has high hopes and dreams about having the ideal college experience, but when he enters the shop he is sucked into the alcoholic activities of the carefree members of the Diving Club who frequent the place. Persuaded by upperclassmen Shinji Tokita and Ryuujirou Kotobuki, Iori reluctantly joins their bizarre party. His cousin Chisa Kotegawa later walks in and catches him in the act, earning Iori her utter disdain.  Based on Kenji Inoue and Kimitake Yoshioka's popular comedy manga, Grand Blue follows Iori's misadventures with his eccentric new friends as he strives to realize his ideal college dream, while also learning how to scuba dive.  [Written by MAL Rewrite]","{'id_original': 37105, 'episodios': 12}"
44511,Chainsaw Man,2022,"['Action', 'Fantasy']","['Ação & Aventura', 'Sci-Fi & Fantasia']",8.44,1066344,https://cdn.myanimelist.net/images/anime/1806/126216.jpg,"Denji is robbed of a normal teenage life, left with nothing but his deadbeat father's overwhelming debt. His only companion is his pet, the chainsaw devil Pochita, with whom he slays devils for money that inevitably ends up in the yakuza's pockets. All Denji can do is dream of a good, simple life: one with delicious food and a beautiful girlfriend by his side. But an act of greedy betrayal by the yakuza leads to Denji's brutal, untimely death, crushing all hope of him ever achieving happiness.  Remarkably, an old contract allows Pochita to merge with the deceased Denji and bestow devil powers on him, changing him into a hybrid able to transform his body parts into chainsaws. Because Denji's new abilities pose a significant risk to society, the Public Safety Bureau's elite devil hunter Makima takes him in, letting him live as long as he obeys her command. Guided by the promise of a content life alongside an attractive woman, Denji devotes everything and fights with all his might to make his naive dreams a reality.  [Written by MAL Rewrite]","{'id_original': 44511, 'episodios': 12}"
50265,Spy x Family,2022,"['Action', 'Award Winning', 'Comedy']","['Comédia & Slice of Life', 'Ação & Aventura']",8.44,1118729,https://cdn.myanimelist.net/images/anime/1441/122795.jpg,"Corrupt politicians, frenzied nationalists, and other warmongering forces constantly jeopardize the thin veneer of peace between neighboring countries Ostania and Westalis. In spite of their plots, renowned spy and master of disguise ""Twilight"" fulfills dangerous missions one after another in the hope that no child will have to experience the horrors of war.  In the bustling Ostanian city of Berlint, Twilight dons the alias of ""Loid Forger,"" an esteemed psychiatrist. However, his true intention is to gather intelligence on prominent politician Donovan Desmond, who only appears rarely in public at his sons' school: the prestigious Eden Academy. Enlisting the help of unmarried city hall clerk Yor Briar to act as his wife and adopting the curious six-year-old orphan Anya as his daughter, Loid enacts his master plan. He will enroll Anya in Eden Academy, where Loid hopes she will excel and give him the opportunity to meet Donovan without arousing suspicion.   Unfortunately for Loid, even a man of his talents has trouble playing the figure of a loving father and husband. And just like Loid is hiding his true identity, Yor—who is an underground assassin known as ""Thorn Princess""—and Anya—an esper who can read people's minds—have no plans to disclose their own secrets either. Although this picture-perfect family is founded on deception, the Forgers gradually come to understand that the love they share for one another trumps all else.  [Written by MAL Rewrite]","{'id_original': 50265, 'episodios': 12}"
136,Hunter x Hunter,1999,"['Action', 'Adventure', 'Fantasy']","['Ação & Aventura', 'Sci-Fi & Fantasia']",8.43,309113,https://cdn.myanimelist.net/images/anime/1305/132237.jpg,"Hunters are specialized in a wide variety of fields, ranging from treasure hunting to cooking. They have access to otherwise unavailable funds and information that allow them to pursue their dreams and interests. However, being a hunter is a special privilege, only attained by taking a deadly exam with an extremely low success rate.  Gon Freecss, a 12-year-old boy with the hope of finding his missing father, sets out on a quest to take the Hunter Exam. Along the way, he picks up three companions who also aim to take the dangerous test: the revenge-seeking Kurapika, aspiring doctor Leorio Paladiknight, and a mischievous child the same age as Gon, Killua Zoldyck.  As the four aspiring hunters embark on a perilous adventure, they fight for their dreams while defying the odds.  [Written by MAL Rewrite]","{'id_original': 136, 'episodios': 62}"
20583,Haikyu!!,2014,['Sports'],[],8.43,1321362,https://cdn.myanimelist.net/images/anime/7/76014.jpg,"Ever since having witnessed the ""Little Giant"" and his astonishing skills on the volleyball court, Shouyou Hinata has been bewitched by the dynamic nature of the sport. Even though his attempt to make his debut as a volleyball regular during a middle school tournament went up in flames, he longs to prove that his less-than-impressive height ceases to be a hindrance in the face of his sheer will and perseverance.  When Hinata enrolls in Karasuno High School, the Little Giant's alma mater, he believes that he is one step closer to his goal of becoming a professional volleyball player. Although the school only retains a shadow of its former glory, Hinata's conviction isn't shaken until he learns that Tobio Kageyama—the prodigy who humiliated Hinata's middle school volleyball team in a crushing defeat—is now his teammate.  To fulfill his desire of leaving a mark on the realm of volleyball—so often regarded as the domain of the tall and the strong—Hinata must smooth out his differences with Kageyama. Only when Hinata learns what it takes to be a part of a team will he be able to join the race to the top in earnest.  [Written by MAL Rewrite]","{'id_original': 20583, 'episodios': 25}"
467,Ghost in the Shell: Stand Alone Complex,2002,"['Award Winning', 'Mystery', 'Sci-Fi']","['Terror & Suspense', 'Estratégia & Puzzle', 'Sci-Fi & Fantasia']",8.42,170707,https://cdn.myanimelist.net/images/anime/11/50857.jpg,"In the not so distant future, mankind has advanced to a state where complete body transplants from flesh to machine is possible. This allows for great increases in both physical and cybernetic prowess and blurring the lines between the two worlds. However, criminals can also make full use of such technology, leading to new and sometimes, very dangerous crimes. In response to such innovative new methods, the Japanese Government has established Section 9, an independently operating police unit which deals with such highly sensitive crimes.  Led by Daisuke Aramaki and Motoko Kusanagi, Section 9 deals with such crimes over the entire social spectrum, usually with success. However, when faced with a new A level hacker nicknamed ""The Laughing Man,"" the team is thrown into a dangerous cat and mouse game, following the hacker's trail as it leaves its mark on Japan.  [Written by MAL Rewrite]","{'id_original': 467, 'episodios': 26}"
38000,Demon Slayer: Kimetsu no Yaiba,2019,"['Action', 'Award Winning', 'Supernatural']","['Terror & Suspense', 'Ação & Aventura', 'Sci-Fi & Fantasia']",8.42,2303527,https://cdn.myanimelist.net/images/anime/1286/99889.jpg,"Ever since the death of his father, the burden of supporting the family has fallen upon Tanjirou Kamado's shoulders. Though living impoverished on a remote mountain, the Kamado family are able to enjoy a relatively peaceful and happy life. One day, Tanjirou decides to go down to the local village to make a little money selling charcoal. On his way back, night falls, forcing Tanjirou to take shelter in the house of a strange man, who warns him of the existence of flesh-eating demons that lurk in the woods at night.  When he finally arrives back home the next day, he is met with a horrifying sight—his whole family has been slaughtered. Worse still, the sole survivor is his sister Nezuko, who has been turned into a bloodthirsty demon. Consumed by rage and hatred, Tanjirou swears to avenge his family and stay by his only remaining sibling. Alongside the mysterious group calling themselves the Demon Slayer Corps, Tanjirou will do whatever it takes to slay the demons and protect the remnants of his beloved sister's humanity.  [Written by MAL Rewrite]","{'id_original': 38000, 'episodios': 26}"
33255,The Disastrous Life of Saiki K.,2016,['Comedy'],['Comédia & Slice of Life'],8.41,680972,https://cdn.myanimelist.net/images/anime/1973/142750.jpg,"To the average person, psychic abilities might seem a blessing; for Kusuo Saiki, however, this could not be further from the truth. Gifted with a wide assortment of supernatural abilities ranging from telepathy to x-ray vision, he finds this so-called blessing to be nothing but a curse. As all the inconveniences his powers cause constantly pile up, all Kusuo aims for is an ordinary, hassle-free life—a life where ignorance is bliss.  Unfortunately, the life of a psychic is far from quiet. Though Kusuo tries to stay out of the spotlight by keeping his powers a secret from his classmates, he ends up inadvertently attracting the attention of many odd characters, such as the empty-headed Riki Nendou and the delusional Shun Kaidou. Forced to deal with the craziness of the people around him, Kusuo comes to learn that the ordinary life he has been striving for is a lot more difficult to achieve than expected.  [Written by MAL Rewrite]","{'id_original': 33255, 'episodios': 120}"
37999,Kaguya-sama: Love is War,2019,"['Comedy', 'Romance']","['Comédia & Slice of Life', 'Drama & Narrativo', 'Romance']",8.4,1184930,https://cdn.myanimelist.net/images/anime/1295/106551.jpg,"At the renowned Shuchiin Academy, Miyuki Shirogane and Kaguya Shinomiya are the student body's top representatives. Ranked the top student in the nation and respected by peers and mentors alike, Miyuki serves as the student council president. Alongside him, the vice president Kaguya—eldest daughter of the wealthy Shinomiya family—excels in every field imaginable. They are the envy of the entire student body, regarded as the perfect couple.  However, despite both having already developed feelings for the other, neither are willing to admit them. The first to confess loses, will be looked down upon, and will be considered the lesser. With their honor and pride at stake, Miyuki and Kaguya are both equally determined to be the one to emerge victorious on the battlefield of love!  [Written by MAL Rewrite]","{'id_original': 37999, 'episodios': 12}"
35557,Land of the Lustrous,2017,"['Action', 'Drama', 'Fantasy', 'Mystery']","['Estratégia & Puzzle', 'Sci-Fi & Fantasia', 'Terror & Suspense', 'Ação & Aventura', 'Drama & Narrativo']",8.39,215298,https://cdn.myanimelist.net/images/anime/3/88293.jpg,"In the mysterious future, crystalline organisms called Gems inhabit a world that has been destroyed by six meteors. Each Gem is assigned a role in order to fight against the Lunarians, a species who attacks them in order to shatter their bodies and use them as decorations.   Phosphophyllite, also known as Phos, is a young and fragile Gem who dreams of helping their friends in the war effort. Instead, they are told to compile an encyclopedia because of their delicate condition. After begrudgingly embarking on this task, Phos meets Cinnabar, an intelligent gem who has been relegated to patrolling the isolated island at night because of the corrosive poison their body creates. After seeing how unhappy Cinnabar is, Phos decides to find a role that both of the rejected Gems can enjoy. Houseki no Kuni follows Phos' efforts to be useful and protect their fellow Gems.  [Written by MAL Rewrite]","{'id_original': 35557, 'episodios': 12}"
37965,Run with the Wind,2018,"['Drama', 'Sports']",['Drama & Narrativo'],8.38,148817,https://cdn.myanimelist.net/images/anime/1936/129119.jpg,"Former ace runner of Sendai Josei High School, Kakeru Kurahara is chased away from a convenience store for shoplifting. Shaking off his pursuer, he runs into Haiji Kiyose, another student from his university. Haiji is impressed by Kakeru's agility and persuades him to live in Chikusei-sou, the run-down apartment where Haiji resides along with eight other students. Having lost his entire apartment deposit at a mahjong parlor, Kakeru accepts the offer reluctantly.  However, Haiji reveals a secret during Kakeru's welcoming party: the apartment is actually the dormitory of the Kansei University Track Club. He unveils his ultimate goal of participating in the Hakone Ekiden—one of the most prominent university marathon relay races in Japan. Unfortunately, all the residents apart from Haiji and Kakeru are complete running novices. Worse still, none of the inhabitants are even remotely interested in being involved with Haiji's ridiculous plan! With only months before the deadline, will the fourth-year student be able to convince them otherwise and realize his elusive dream of running in the Hakone Ekiden?  [Written by MAL Rewrite]","{'id_original': 37965, 'episodios': 23}"
46095,Vivy -Fluorite Eye's Song-,2021,"['Action', 'Sci-Fi', 'Suspense']","['Ação & Aventura', 'Sci-Fi & Fantasia']",8.38,266841,https://cdn.myanimelist.net/images/anime/1551/128960.jpg,"When highly evolved AIs set out to eradicate mankind, the carnage that ensues fills the air with the stench of fresh blood and burning bodies. In a desperate bid to prevent the calamity from ever occurring, a scientist bets everything on a remnant from the past.  Turning the clock back a hundred years, AIs are already an integral part of human society, programmed with specific missions meant to be carried out for their entire course of operation. Vivy, the first ever autonomous AI, is a songstress tasked with spreading happiness through her voice. In a theme park where she hardly ever gets a proper audience, she strives to pour her heart out into her performances, bound to repeat it day after day—that is, until an advanced AI from the future appears before her and enlists her help in stopping a devastating war a hundred years in the making. With no time to process the revelation that flips her world upside down, Vivy is catapulted into a century-long journey to avert the violent history yet to come.  [Written by MAL Rewrite]","{'id_original': 46095, 'episodios': 13}"
9756,Puella Magi Madoka Magica,2011,"['Award Winning', 'Drama', 'Suspense']",['Drama & Narrativo'],8.38,801909,https://cdn.myanimelist.net/images/anime/11/55225.jpg,"Madoka Kaname and Sayaka Miki are regular middle school girls with regular lives, but all that changes when they encounter Kyuubey, a cat-like magical familiar, and Homura Akemi, the new transfer student.  Kyuubey offers them a proposition: he will grant any one of their wishes and in exchange, they will each become a magical girl, gaining enough power to fulfill their dreams. However, Homura Akemi, a magical girl herself, urges them not to accept the offer, stating that everything is not what it seems.  A story of hope, despair, and friendship, Mahou Shoujo Madoka★Magica deals with the difficulties of being a magical girl and the price one has to pay to make a dream come true.  [Written by MAL Rewrite]","{'id_original': 9756, 'episodios': 12}"
